21:17:06.876200 IP aj205-224.resnet.stonybrook.edu.3389 > 172.24.237.19.55460: Flags [P.], seq 941674995:941675064, ack 1993799515, win 255, length 69
21:17:06.892960 IP aj205-224.resnet.stonybrook.edu.3389 > 172.24.237.19.55460: Flags [P.], seq 69:138, ack 70, win 254, length 69
21:17:07.900152 IP aj205-224.resnet.stonybrook.edu.3389 > 172.24.237.19.55460: Flags [P.], seq 138:207, ack 139, win 254, length 69
21:17:07.908506 IP mandar-Studio-1555.59212 > 220.181.138.59.www: Flags [F.], seq 2996875009, ack 3096830855, win 125, options [nop,nop,TS val 5673478 ecr 1853097850], length 0

