18:52:11.283029 IP workstation.local.2222 > 172.24.237.51.58720: Flags [P.], seq 1235564056:1235565040, ack 957669989, win 905, options [nop,nop,TS val 688741 ecr 1692885], length 984
18:52:11.341966 IP workstation.local.2222 > 172.24.237.51.58720: Flags [P.], seq 984:1296, ack 1353, win 1064, options [nop,nop,TS val 688756 ecr 1692900], length 312
18:52:11.415002 IP workstation.local.2222 > 172.24.237.51.58720: Flags [P.], seq 1296:1344, ack 1417, win 1064, options [nop,nop,TS val 688774 ecr 1692922], length 48
18:52:16.421554 IP workstation.local.2222 > 172.24.237.51.58720: Flags [P.], seq 1344:1424, ack 1481, win 1064, options [nop,nop,TS val 690026 ecr 1692923], length 80
18:52:16.424613 IP workstation.local.2222 > 172.24.237.51.58720: Flags [P.], seq 1424:1504, ack 1849, win 1223, options [nop,nop,TS val 690027 ecr 1694175], length 80
18:52:16.426530 IP workstation.local.2222 > 172.24.237.51.58720: Flags [P.], seq 1504:1584, ack 1945, win 1223, options [nop,nop,TS val 690027 ecr 1694176], length 80
18:52:21.037721 IP workstation.local.2222 > 172.24.237.51.58720: Flags [P.], seq 1616:2816, ack 3289, win 1541, options [nop,nop,TS val 691180 ecr 1695328], length 1200
18:52:21.041252 IP workstation.local.2222 > 172.24.237.51.58720: Flags [P.], seq 2816:4016, ack 4489, win 1691, options [nop,nop,TS val 691181 ecr 1695329], length 1200
18:52:21.044063 IP workstation.local.2222 > 172.24.237.51.58720: Flags [.], seq 4016:5390, ack 4489, win 1691, options [nop,nop,TS val 691181 ecr 1695329], length 1374
18:52:21.045945 IP workstation.local.2222 > 172.24.237.51.58720: Flags [P.], seq 5390:6416, ack 4489, win 1691, options [nop,nop,TS val 691182 ecr 1695330], length 1026
18:52:21.048472 IP workstation.local.2222 > 172.24.237.51.58720: Flags [.], seq 6416:7790, ack 4489, win 1691, options [nop,nop,TS val 691183 ecr 1695330], length 1374
18:52:21.050392 IP workstation.local.2222 > 172.24.237.51.58720: Flags [P.], seq 7790:8816, ack 4489, win 1691, options [nop,nop,TS val 691183 ecr 1695332], length 1026
18:52:21.052912 IP workstation.local.2222 > 172.24.237.51.58720: Flags [.], seq 8816:10190, ack 4489, win 1691, options [nop,nop,TS val 691184 ecr 1695332], length 1374
18:52:21.054868 IP workstation.local.2222 > 172.24.237.51.58720: Flags [P.], seq 10190:11216, ack 4489, win 1691, options [nop,nop,TS val 691184 ecr 1695333], length 1026
18:52:21.057162 IP workstation.local.2222 > 172.24.237.51.58720: Flags [.], seq 11216:12590, ack 4489, win 1691, options [nop,nop,TS val 691185 ecr 1695333], length 1374
18:52:21.059335 IP workstation.local.2222 > 172.24.237.51.58720: Flags [.], seq 12590:13964, ack 4489, win 1691, options [nop,nop,TS val 691185 ecr 1695333], length 1374
18:52:21.059954 IP workstation.local.2222 > 172.24.237.51.58720: Flags [P.], seq 13964:14816, ack 4489, win 1691, options [nop,nop,TS val 691185 ecr 1695334], length 852
18:52:21.061872 IP workstation.local.2222 > 172.24.237.51.58720: Flags [P.], seq 14816:16016, ack 4489, win 1691, options [nop,nop,TS val 691186 ecr 1695334], length 1200
18:52:21.066035 IP workstation.local.2222 > 172.24.237.51.58720: Flags [.], seq 16016:17390, ack 4489, win 1691, options [nop,nop,TS val 691187 ecr 1695334], length 1374
18:52:21.067992 IP workstation.local.2222 > 172.24.237.51.58720: Flags [P.], seq 17390:18416, ack 4489, win 1691, options [nop,nop,TS val 691187 ecr 1695336], length 1026
18:52:21.070476 IP workstation.local.2222 > 172.24.237.51.58720: Flags [.], seq 18416:19790, ack 4489, win 1691, options [nop,nop,TS val 691188 ecr 1695336], length 1374
18:52:21.072335 IP workstation.local.2222 > 172.24.237.51.58720: Flags [P.], seq 19790:20816, ack 4489, win 1691, options [nop,nop,TS val 691189 ecr 1695337], length 1026
18:52:21.076354 IP workstation.local.2222 > 172.24.237.51.58720: Flags [.], seq 20816:22190, ack 4489, win 1691, options [nop,nop,TS val 691190 ecr 1695337], length 1374
18:52:21.078378 IP workstation.local.2222 > 172.24.237.51.58720: Flags [P.], seq 22190:23216, ack 4489, win 1691, options [nop,nop,TS val 691190 ecr 1695339], length 1026
18:52:21.080530 IP workstation.local.2222 > 172.24.237.51.58720: Flags [.], seq 23216:24590, ack 4489, win 1691, options [nop,nop,TS val 691191 ecr 1695339], length 1374
18:52:21.082639 IP workstation.local.2222 > 172.24.237.51.58720: Flags [.], seq 24590:25964, ack 4489, win 1691, options [nop,nop,TS val 691191 ecr 1695339], length 1374
18:52:21.083323 IP workstation.local.2222 > 172.24.237.51.58720: Flags [P.], seq 25964:26816, ack 4489, win 1691, options [nop,nop,TS val 691191 ecr 1695340], length 852
18:52:21.085728 IP workstation.local.2222 > 172.24.237.51.58720: Flags [P.], seq 26816:28016, ack 4489, win 1691, options [nop,nop,TS val 691192 ecr 1695340], length 1200
18:52:21.089004 IP workstation.local.2222 > 172.24.237.51.58720: Flags [.], seq 28016:29390, ack 4489, win 1691, options [nop,nop,TS val 691193 ecr 1695340], length 1374
18:52:21.090972 IP workstation.local.2222 > 172.24.237.51.58720: Flags [P.], seq 29390:30416, ack 4489, win 1691, options [nop,nop,TS val 691193 ecr 1695342], length 1026
18:52:21.093381 IP workstation.local.2222 > 172.24.237.51.58720: Flags [.], seq 30416:31790, ack 4489, win 1691, options [nop,nop,TS val 691194 ecr 1695342], length 1374
18:52:21.095332 IP workstation.local.2222 > 172.24.237.51.58720: Flags [P.], seq 31790:32816, ack 4489, win 1691, options [nop,nop,TS val 691194 ecr 1695343], length 1026
18:52:21.097845 IP workstation.local.2222 > 172.24.237.51.58720: Flags [.], seq 32816:34190, ack 4489, win 1691, options [nop,nop,TS val 691195 ecr 1695343], length 1374
18:52:21.099783 IP workstation.local.2222 > 172.24.237.51.58720: Flags [P.], seq 34190:35216, ack 4489, win 1691, options [nop,nop,TS val 691195 ecr 1695344], length 1026
18:52:21.102188 IP workstation.local.2222 > 172.24.237.51.58720: Flags [.], seq 35216:36590, ack 4489, win 1691, options [nop,nop,TS val 691196 ecr 1695344], length 1374
18:52:21.104441 IP workstation.local.2222 > 172.24.237.51.58720: Flags [P.], seq 36590:37616, ack 4489, win 1691, options [nop,nop,TS val 691197 ecr 1695345], length 1026
18:52:21.106489 IP workstation.local.2222 > 172.24.237.51.58720: Flags [.], seq 37616:38990, ack 4489, win 1691, options [nop,nop,TS val 691197 ecr 1695345], length 1374
18:52:21.108380 IP workstation.local.2222 > 172.24.237.51.58720: Flags [P.], seq 38990:40016, ack 4489, win 1691, options [nop,nop,TS val 691198 ecr 1695346], length 1026
18:52:21.110888 IP workstation.local.2222 > 172.24.237.51.58720: Flags [.], seq 40016:41390, ack 4489, win 1691, options [nop,nop,TS val 691198 ecr 1695346], length 1374
18:52:21.113000 IP workstation.local.2222 > 172.24.237.51.58720: Flags [.], seq 41390:42764, ack 4489, win 1691, options [nop,nop,TS val 691199 ecr 1695346], length 1374
18:52:21.114793 IP workstation.local.2222 > 172.24.237.51.58720: Flags [P.], seq 42764:43616, ack 4489, win 1691, options [nop,nop,TS val 691199 ecr 1695348], length 852
18:52:21.117297 IP workstation.local.2222 > 172.24.237.51.58720: Flags [.], seq 43616:44990, ack 4489, win 1691, options [nop,nop,TS val 691200 ecr 1695348], length 1374
18:52:21.117850 IP workstation.local.2222 > 172.24.237.51.58720: Flags [P.], seq 44990:46016, ack 4489, win 1691, options [nop,nop,TS val 691200 ecr 1695348], length 1026
18:52:21.119781 IP workstation.local.2222 > 172.24.237.51.58720: Flags [P.], seq 46016:47216, ack 4489, win 1691, options [nop,nop,TS val 691200 ecr 1695349], length 1200
18:52:21.123687 IP workstation.local.2222 > 172.24.237.51.58720: Flags [.], seq 47216:48590, ack 4489, win 1691, options [nop,nop,TS val 691201 ecr 1695349], length 1374
18:52:21.125595 IP workstation.local.2222 > 172.24.237.51.58720: Flags [P.], seq 48590:49616, ack 4489, win 1691, options [nop,nop,TS val 691202 ecr 1695350], length 1026
18:52:21.127949 IP workstation.local.2222 > 172.24.237.51.58720: Flags [.], seq 49616:50990, ack 4489, win 1691, options [nop,nop,TS val 691202 ecr 1695350], length 1374
18:52:21.129925 IP workstation.local.2222 > 172.24.237.51.58720: Flags [P.], seq 50990:52016, ack 4489, win 1691, options [nop,nop,TS val 691203 ecr 1695351], length 1026
18:52:21.132199 IP workstation.local.2222 > 172.24.237.51.58720: Flags [.], seq 52016:53390, ack 4489, win 1691, options [nop,nop,TS val 691203 ecr 1695351], length 1374
18:52:21.134083 IP workstation.local.2222 > 172.24.237.51.58720: Flags [P.], seq 53390:54416, ack 4489, win 1691, options [nop,nop,TS val 691204 ecr 1695352], length 1026
18:52:21.136458 IP workstation.local.2222 > 172.24.237.51.58720: Flags [.], seq 54416:55790, ack 4489, win 1691, options [nop,nop,TS val 691205 ecr 1695352], length 1374
18:52:21.138417 IP workstation.local.2222 > 172.24.237.51.58720: Flags [P.], seq 55790:56816, ack 4489, win 1691, options [nop,nop,TS val 691205 ecr 1695354], length 1026
18:52:21.140780 IP workstation.local.2222 > 172.24.237.51.58720: Flags [.], seq 56816:58190, ack 4489, win 1691, options [nop,nop,TS val 691206 ecr 1695354], length 1374
18:52:21.142918 IP workstation.local.2222 > 172.24.237.51.58720: Flags [.], seq 58190:59564, ack 4489, win 1691, options [nop,nop,TS val 691206 ecr 1695354], length 1374
18:52:21.144176 IP workstation.local.2222 > 172.24.237.51.58720: Flags [P.], seq 59564:60416, ack 4489, win 1691, options [nop,nop,TS val 691206 ecr 1695355], length 852
18:52:21.145957 IP workstation.local.2222 > 172.24.237.51.58720: Flags [P.], seq 60416:61616, ack 4489, win 1691, options [nop,nop,TS val 691207 ecr 1695355], length 1200
18:52:21.149364 IP workstation.local.2222 > 172.24.237.51.58720: Flags [.], seq 61616:62990, ack 4489, win 1691, options [nop,nop,TS val 691208 ecr 1695355], length 1374
18:52:21.151469 IP workstation.local.2222 > 172.24.237.51.58720: Flags [.], seq 62990:64364, ack 4489, win 1691, options [nop,nop,TS val 691208 ecr 1695355], length 1374
18:52:21.153644 IP workstation.local.2222 > 172.24.237.51.58720: Flags [.], seq 64364:65738, ack 4489, win 1691, options [nop,nop,TS val 691209 ecr 1695355], length 1374
18:52:21.155760 IP workstation.local.2222 > 172.24.237.51.58720: Flags [.], seq 65738:67112, ack 4489, win 1691, options [nop,nop,TS val 691209 ecr 1695355], length 1374
18:52:21.157611 IP workstation.local.2222 > 172.24.237.51.58720: Flags [P.], seq 67112:67616, ack 4489, win 1691, options [nop,nop,TS val 691210 ecr 1695358], length 504
18:52:21.160016 IP workstation.local.2222 > 172.24.237.51.58720: Flags [.], seq 67616:68990, ack 4489, win 1691, options [nop,nop,TS val 691210 ecr 1695359], length 1374
18:52:21.160582 IP workstation.local.2222 > 172.24.237.51.58720: Flags [P.], seq 68990:70016, ack 4489, win 1691, options [nop,nop,TS val 691211 ecr 1695359], length 1026
18:52:21.162933 IP workstation.local.2222 > 172.24.237.51.58720: Flags [P.], seq 70016:71216, ack 4489, win 1691, options [nop,nop,TS val 691211 ecr 1695360], length 1200
18:52:21.166454 IP workstation.local.2222 > 172.24.237.51.58720: Flags [.], seq 71216:72590, ack 4489, win 1691, options [nop,nop,TS val 691212 ecr 1695360], length 1374
18:52:21.168358 IP workstation.local.2222 > 172.24.237.51.58720: Flags [P.], seq 72590:73616, ack 4489, win 1691, options [nop,nop,TS val 691213 ecr 1695361], length 1026
18:52:21.170723 IP workstation.local.2222 > 172.24.237.51.58720: Flags [.], seq 73616:74990, ack 4489, win 1691, options [nop,nop,TS val 691213 ecr 1695361], length 1374
18:52:21.172659 IP workstation.local.2222 > 172.24.237.51.58720: Flags [P.], seq 74990:76016, ack 4489, win 1691, options [nop,nop,TS val 691214 ecr 1695362], length 1026
18:52:21.175450 IP workstation.local.2222 > 172.24.237.51.58720: Flags [.], seq 76016:77390, ack 4489, win 1691, options [nop,nop,TS val 691214 ecr 1695362], length 1374
18:52:21.177628 IP workstation.local.2222 > 172.24.237.51.58720: Flags [.], seq 77390:78764, ack 4489, win 1691, options [nop,nop,TS val 691215 ecr 1695362], length 1374
18:52:21.177725 IP workstation.local.2222 > 172.24.237.51.58720: Flags [P.], seq 78764:79616, ack 4489, win 1691, options [nop,nop,TS val 691215 ecr 1695363], length 852
18:52:21.180006 IP workstation.local.2222 > 172.24.237.51.58720: Flags [P.], seq 79616:80816, ack 4489, win 1691, options [nop,nop,TS val 691215 ecr 1695364], length 1200
18:52:21.184050 IP workstation.local.2222 > 172.24.237.51.58720: Flags [.], seq 80816:82190, ack 4489, win 1691, options [nop,nop,TS val 691216 ecr 1695364], length 1374
18:52:21.186195 IP workstation.local.2222 > 172.24.237.51.58720: Flags [.], seq 82190:83564, ack 4489, win 1691, options [nop,nop,TS val 691217 ecr 1695364], length 1374
18:52:21.187560 IP workstation.local.2222 > 172.24.237.51.58720: Flags [P.], seq 83564:84416, ack 4489, win 1691, options [nop,nop,TS val 691217 ecr 1695366], length 852
18:52:21.190456 IP workstation.local.2222 > 172.24.237.51.58720: Flags [.], seq 84416:85790, ack 4489, win 1691, options [nop,nop,TS val 691218 ecr 1695366], length 1374
18:52:21.191082 IP workstation.local.2222 > 172.24.237.51.58720: Flags [P.], seq 85790:86816, ack 4489, win 1691, options [nop,nop,TS val 691218 ecr 1695367], length 1026
18:52:21.192957 IP workstation.local.2222 > 172.24.237.51.58720: Flags [P.], seq 86816:88016, ack 4489, win 1691, options [nop,nop,TS val 691219 ecr 1695367], length 1200
18:52:21.196837 IP workstation.local.2222 > 172.24.237.51.58720: Flags [.], seq 88016:89390, ack 4489, win 1691, options [nop,nop,TS val 691220 ecr 1695367], length 1374
18:52:21.198715 IP workstation.local.2222 > 172.24.237.51.58720: Flags [P.], seq 89390:90416, ack 4489, win 1691, options [nop,nop,TS val 691220 ecr 1695369], length 1026
18:52:21.201135 IP workstation.local.2222 > 172.24.237.51.58720: Flags [.], seq 90416:91790, ack 4489, win 1691, options [nop,nop,TS val 691221 ecr 1695369], length 1374
18:52:21.203080 IP workstation.local.2222 > 172.24.237.51.58720: Flags [P.], seq 91790:92816, ack 4489, win 1691, options [nop,nop,TS val 691221 ecr 1695370], length 1026
18:52:21.205417 IP workstation.local.2222 > 172.24.237.51.58720: Flags [.], seq 92816:94190, ack 4489, win 1691, options [nop,nop,TS val 691222 ecr 1695370], length 1374
18:52:21.207330 IP workstation.local.2222 > 172.24.237.51.58720: Flags [P.], seq 94190:95216, ack 4489, win 1691, options [nop,nop,TS val 691222 ecr 1695371], length 1026
18:52:21.209671 IP workstation.local.2222 > 172.24.237.51.58720: Flags [.], seq 95216:96590, ack 4489, win 1691, options [nop,nop,TS val 691223 ecr 1695371], length 1374
18:52:21.211573 IP workstation.local.2222 > 172.24.237.51.58720: Flags [P.], seq 96590:97616, ack 4489, win 1691, options [nop,nop,TS val 691223 ecr 1695372], length 1026
18:52:21.213967 IP workstation.local.2222 > 172.24.237.51.58720: Flags [.], seq 97616:98990, ack 4489, win 1691, options [nop,nop,TS val 691224 ecr 1695372], length 1374
18:52:21.216107 IP workstation.local.2222 > 172.24.237.51.58720: Flags [.], seq 98990:100364, ack 4489, win 1691, options [nop,nop,TS val 691224 ecr 1695372], length 1374
18:52:21.217202 IP workstation.local.2222 > 172.24.237.51.58720: Flags [P.], seq 100364:101216, ack 4489, win 1691, options [nop,nop,TS val 691225 ecr 1695373], length 852
18:52:21.218936 IP workstation.local.2222 > 172.24.237.51.58720: Flags [P.], seq 101216:102416, ack 4489, win 1691, options [nop,nop,TS val 691225 ecr 1695374], length 1200
18:52:21.222494 IP workstation.local.2222 > 172.24.237.51.58720: Flags [.], seq 102416:103790, ack 4489, win 1691, options [nop,nop,TS val 691226 ecr 1695374], length 1374
18:52:21.224605 IP workstation.local.2222 > 172.24.237.51.58720: Flags [.], seq 103790:105164, ack 4489, win 1691, options [nop,nop,TS val 691227 ecr 1695374], length 1374
18:52:21.225127 IP workstation.local.2222 > 172.24.237.51.58720: Flags [P.], seq 105164:106016, ack 4489, win 1691, options [nop,nop,TS val 691227 ecr 1695375], length 852
18:52:21.227188 IP workstation.local.2222 > 172.24.237.51.58720: Flags [P.], seq 106016:107216, ack 4489, win 1691, options [nop,nop,TS val 691227 ecr 1695376], length 1200
18:52:21.231096 IP workstation.local.2222 > 172.24.237.51.58720: Flags [.], seq 107216:108590, ack 4489, win 1691, options [nop,nop,TS val 691228 ecr 1695376], length 1374
18:52:21.233277 IP workstation.local.2222 > 172.24.237.51.58720: Flags [.], seq 108590:109964, ack 4489, win 1691, options [nop,nop,TS val 691229 ecr 1695376], length 1374
18:52:21.235401 IP workstation.local.2222 > 172.24.237.51.58720: Flags [.], seq 109964:111338, ack 4489, win 1691, options [nop,nop,TS val 691229 ecr 1695376], length 1374
18:52:21.237542 IP workstation.local.2222 > 172.24.237.51.58720: Flags [.], seq 111338:112712, ack 4489, win 1691, options [nop,nop,TS val 691230 ecr 1695376], length 1374
18:52:21.239683 IP workstation.local.2222 > 172.24.237.51.58720: Flags [.], seq 112712:114086, ack 4489, win 1691, options [nop,nop,TS val 691230 ecr 1695376], length 1374
18:52:21.241813 IP workstation.local.2222 > 172.24.237.51.58720: Flags [.], seq 114086:115460, ack 4489, win 1691, options [nop,nop,TS val 691231 ecr 1695376], length 1374
18:52:21.246091 IP workstation.local.2222 > 172.24.237.51.58720: Flags [.], seq 115460:116834, ack 4489, win 1691, options [nop,nop,TS val 691232 ecr 1695376], length 1374
18:52:21.247063 IP workstation.local.2222 > 172.24.237.51.58720: Flags [P.], seq 116834:118016, ack 4489, win 1691, options [nop,nop,TS val 691232 ecr 1695381], length 1182
18:52:21.250372 IP workstation.local.2222 > 172.24.237.51.58720: Flags [.], seq 118016:119390, ack 4489, win 1691, options [nop,nop,TS val 691233 ecr 1695381], length 1374
18:52:21.252500 IP workstation.local.2222 > 172.24.237.51.58720: Flags [.], seq 119390:120764, ack 4489, win 1691, options [nop,nop,TS val 691234 ecr 1695382], length 1374
18:52:21.253960 IP workstation.local.2222 > 172.24.237.51.58720: Flags [P.], seq 120764:121616, ack 4489, win 1691, options [nop,nop,TS val 691234 ecr 1695382], length 852
18:52:21.255772 IP workstation.local.2222 > 172.24.237.51.58720: Flags [P.], seq 121616:122816, ack 4489, win 1691, options [nop,nop,TS val 691234 ecr 1695383], length 1200
18:52:21.258961 IP workstation.local.2222 > 172.24.237.51.58720: Flags [.], seq 122816:124190, ack 4489, win 1691, options [nop,nop,TS val 691235 ecr 1695383], length 1374
18:52:21.260820 IP workstation.local.2222 > 172.24.237.51.58720: Flags [P.], seq 124190:125216, ack 4489, win 1691, options [nop,nop,TS val 691236 ecr 1695384], length 1026
18:52:21.263225 IP workstation.local.2222 > 172.24.237.51.58720: Flags [.], seq 125216:126590, ack 4489, win 1691, options [nop,nop,TS val 691236 ecr 1695384], length 1374
18:52:21.265079 IP workstation.local.2222 > 172.24.237.51.58720: Flags [P.], seq 126590:127616, ack 4489, win 1691, options [nop,nop,TS val 691237 ecr 1695385], length 1026
18:52:21.267475 IP workstation.local.2222 > 172.24.237.51.58720: Flags [.], seq 127616:128990, ack 4489, win 1691, options [nop,nop,TS val 691237 ecr 1695385], length 1374
18:52:21.269613 IP workstation.local.2222 > 172.24.237.51.58720: Flags [.], seq 128990:130364, ack 4489, win 1691, options [nop,nop,TS val 691238 ecr 1695385], length 1374
18:52:21.269651 IP workstation.local.2222 > 172.24.237.51.58720: Flags [P.], seq 130364:131216, ack 4489, win 1691, options [nop,nop,TS val 691238 ecr 1695386], length 852
18:52:21.271935 IP workstation.local.2222 > 172.24.237.51.58720: Flags [P.], seq 131216:132416, ack 4489, win 1691, options [nop,nop,TS val 691238 ecr 1695387], length 1200
18:52:21.276021 IP workstation.local.2222 > 172.24.237.51.58720: Flags [.], seq 132416:133790, ack 4489, win 1691, options [nop,nop,TS val 691239 ecr 1695387], length 1374
18:52:21.277946 IP workstation.local.2222 > 172.24.237.51.58720: Flags [P.], seq 133790:134816, ack 4489, win 1691, options [nop,nop,TS val 691240 ecr 1695388], length 1026
18:52:21.280299 IP workstation.local.2222 > 172.24.237.51.58720: Flags [.], seq 134816:136190, ack 4489, win 1691, options [nop,nop,TS val 691241 ecr 1695388], length 1374
18:52:21.282197 IP workstation.local.2222 > 172.24.237.51.58720: Flags [P.], seq 136190:137216, ack 4489, win 1691, options [nop,nop,TS val 691241 ecr 1695389], length 1026
18:52:21.284557 IP workstation.local.2222 > 172.24.237.51.58720: Flags [.], seq 137216:138590, ack 4489, win 1691, options [nop,nop,TS val 691242 ecr 1695389], length 1374
18:52:21.286464 IP workstation.local.2222 > 172.24.237.51.58720: Flags [P.], seq 138590:139616, ack 4489, win 1691, options [nop,nop,TS val 691242 ecr 1695391], length 1026
18:52:21.288854 IP workstation.local.2222 > 172.24.237.51.58720: Flags [.], seq 139616:140990, ack 4489, win 1691, options [nop,nop,TS val 691243 ecr 1695391], length 1374
18:52:21.290718 IP workstation.local.2222 > 172.24.237.51.58720: Flags [P.], seq 140990:142016, ack 4489, win 1691, options [nop,nop,TS val 691243 ecr 1695392], length 1026
18:52:21.293155 IP workstation.local.2222 > 172.24.237.51.58720: Flags [.], seq 142016:143390, ack 4489, win 1691, options [nop,nop,TS val 691244 ecr 1695392], length 1374
18:52:21.295291 IP workstation.local.2222 > 172.24.237.51.58720: Flags [.], seq 143390:144764, ack 4489, win 1691, options [nop,nop,TS val 691244 ecr 1695392], length 1374
18:52:21.295371 IP workstation.local.2222 > 172.24.237.51.58720: Flags [P.], seq 144764:145616, ack 4489, win 1691, options [nop,nop,TS val 691244 ecr 1695393], length 852
18:52:21.298064 IP workstation.local.2222 > 172.24.237.51.58720: Flags [P.], seq 145616:146816, ack 4489, win 1691, options [nop,nop,TS val 691245 ecr 1695393], length 1200
18:52:21.301769 IP workstation.local.2222 > 172.24.237.51.58720: Flags [.], seq 146816:148190, ack 4489, win 1691, options [nop,nop,TS val 691246 ecr 1695393], length 1374
18:52:21.303624 IP workstation.local.2222 > 172.24.237.51.58720: Flags [P.], seq 148190:149216, ack 4489, win 1691, options [nop,nop,TS val 691246 ecr 1695395], length 1026
18:52:21.306127 IP workstation.local.2222 > 172.24.237.51.58720: Flags [.], seq 149216:150590, ack 4489, win 1691, options [nop,nop,TS val 691247 ecr 1695395], length 1374
18:52:21.308328 IP workstation.local.2222 > 172.24.237.51.58720: Flags [.], seq 150590:151964, ack 4489, win 1691, options [nop,nop,TS val 691248 ecr 1695395], length 1374
18:52:21.309519 IP workstation.local.2222 > 172.24.237.51.58720: Flags [P.], seq 151964:152816, ack 4489, win 1691, options [nop,nop,TS val 691248 ecr 1695396], length 852
18:52:21.311579 IP workstation.local.2222 > 172.24.237.51.58720: Flags [P.], seq 152816:154016, ack 4489, win 1691, options [nop,nop,TS val 691248 ecr 1695397], length 1200
18:52:21.314708 IP workstation.local.2222 > 172.24.237.51.58720: Flags [.], seq 154016:155390, ack 4489, win 1691, options [nop,nop,TS val 691249 ecr 1695397], length 1374
18:52:21.316878 IP workstation.local.2222 > 172.24.237.51.58720: Flags [.], seq 155390:156764, ack 4489, win 1691, options [nop,nop,TS val 691250 ecr 1695397], length 1374
18:52:21.319053 IP workstation.local.2222 > 172.24.237.51.58720: Flags [.], seq 156764:158138, ack 4489, win 1691, options [nop,nop,TS val 691250 ecr 1695397], length 1374
18:52:21.319408 IP workstation.local.2222 > 172.24.237.51.58720: Flags [P.], seq 158138:158816, ack 4489, win 1691, options [nop,nop,TS val 691250 ecr 1695399], length 678
18:52:21.323407 IP workstation.local.2222 > 172.24.237.51.58720: Flags [.], seq 158816:160190, ack 4489, win 1691, options [nop,nop,TS val 691251 ecr 1695399], length 1374
18:52:21.325266 IP workstation.local.2222 > 172.24.237.51.58720: Flags [P.], seq 160190:161216, ack 4489, win 1691, options [nop,nop,TS val 691252 ecr 1695400], length 1026
18:52:21.327725 IP workstation.local.2222 > 172.24.237.51.58720: Flags [.], seq 161216:162590, ack 4489, win 1691, options [nop,nop,TS val 691252 ecr 1695400], length 1374
18:52:21.329898 IP workstation.local.2222 > 172.24.237.51.58720: Flags [.], seq 162590:163964, ack 4489, win 1691, options [nop,nop,TS val 691253 ecr 1695400], length 1374
18:52:21.330417 IP workstation.local.2222 > 172.24.237.51.58720: Flags [P.], seq 163964:164816, ack 4489, win 1691, options [nop,nop,TS val 691253 ecr 1695401], length 852
18:52:21.332143 IP workstation.local.2222 > 172.24.237.51.58720: Flags [P.], seq 164816:166016, ack 4489, win 1691, options [nop,nop,TS val 691253 ecr 1695402], length 1200
18:52:21.336360 IP workstation.local.2222 > 172.24.237.51.58720: Flags [.], seq 166016:167390, ack 4489, win 1691, options [nop,nop,TS val 691255 ecr 1695402], length 1374
18:52:21.338260 IP workstation.local.2222 > 172.24.237.51.58720: Flags [P.], seq 167390:168416, ack 4489, win 1691, options [nop,nop,TS val 691255 ecr 1695403], length 1026
18:52:21.340665 IP workstation.local.2222 > 172.24.237.51.58720: Flags [.], seq 168416:169790, ack 4489, win 1691, options [nop,nop,TS val 691256 ecr 1695403], length 1374
18:52:21.342542 IP workstation.local.2222 > 172.24.237.51.58720: Flags [P.], seq 169790:170816, ack 4489, win 1691, options [nop,nop,TS val 691256 ecr 1695405], length 1026
18:52:21.345045 IP workstation.local.2222 > 172.24.237.51.58720: Flags [.], seq 170816:172190, ack 4489, win 1691, options [nop,nop,TS val 691257 ecr 1695405], length 1374
18:52:21.347187 IP workstation.local.2222 > 172.24.237.51.58720: Flags [.], seq 172190:173564, ack 4489, win 1691, options [nop,nop,TS val 691257 ecr 1695405], length 1374
18:52:21.347954 IP workstation.local.2222 > 172.24.237.51.58720: Flags [P.], seq 173564:174416, ack 4489, win 1691, options [nop,nop,TS val 691257 ecr 1695406], length 852
18:52:21.350264 IP workstation.local.2222 > 172.24.237.51.58720: Flags [P.], seq 174416:175616, ack 4489, win 1691, options [nop,nop,TS val 691258 ecr 1695406], length 1200
18:52:21.353774 IP workstation.local.2222 > 172.24.237.51.58720: Flags [.], seq 175616:176990, ack 4489, win 1691, options [nop,nop,TS val 691259 ecr 1695406], length 1374
18:52:21.355953 IP workstation.local.2222 > 172.24.237.51.58720: Flags [.], seq 176990:178364, ack 4489, win 1691, options [nop,nop,TS val 691259 ecr 1695406], length 1374
18:52:21.356048 IP workstation.local.2222 > 172.24.237.51.58720: Flags [P.], seq 178364:179216, ack 4489, win 1691, options [nop,nop,TS val 691259 ecr 1695408], length 852
18:52:21.358298 IP workstation.local.2222 > 172.24.237.51.58720: Flags [P.], seq 179216:180416, ack 4489, win 1691, options [nop,nop,TS val 691260 ecr 1695409], length 1200
18:52:21.362459 IP workstation.local.2222 > 172.24.237.51.58720: Flags [.], seq 180416:181790, ack 4489, win 1691, options [nop,nop,TS val 691261 ecr 1695409], length 1374
18:52:21.364332 IP workstation.local.2222 > 172.24.237.51.58720: Flags [P.], seq 181790:182816, ack 4489, win 1691, options [nop,nop,TS val 691262 ecr 1695410], length 1026
18:52:21.366851 IP workstation.local.2222 > 172.24.237.51.58720: Flags [.], seq 182816:184190, ack 4489, win 1691, options [nop,nop,TS val 691262 ecr 1695410], length 1374
18:52:21.368764 IP workstation.local.2222 > 172.24.237.51.58720: Flags [P.], seq 184190:185216, ack 4489, win 1691, options [nop,nop,TS val 691263 ecr 1695411], length 1026
18:52:21.371266 IP workstation.local.2222 > 172.24.237.51.58720: Flags [.], seq 185216:186590, ack 4489, win 1691, options [nop,nop,TS val 691263 ecr 1695411], length 1374
18:52:21.373144 IP workstation.local.2222 > 172.24.237.51.58720: Flags [P.], seq 186590:187616, ack 4489, win 1691, options [nop,nop,TS val 691264 ecr 1695412], length 1026
18:52:21.375660 IP workstation.local.2222 > 172.24.237.51.58720: Flags [.], seq 187616:188990, ack 4489, win 1691, options [nop,nop,TS val 691264 ecr 1695412], length 1374
18:52:21.377768 IP workstation.local.2222 > 172.24.237.51.58720: Flags [.], seq 188990:190364, ack 4489, win 1691, options [nop,nop,TS val 691265 ecr 1695412], length 1374
18:52:21.378688 IP workstation.local.2222 > 172.24.237.51.58720: Flags [P.], seq 190364:191216, ack 4489, win 1691, options [nop,nop,TS val 691265 ecr 1695414], length 852
18:52:21.381246 IP workstation.local.2222 > 172.24.237.51.58720: Flags [P.], seq 191216:192416, ack 4489, win 1691, options [nop,nop,TS val 691266 ecr 1695414], length 1200
18:52:21.384323 IP workstation.local.2222 > 172.24.237.51.58720: Flags [.], seq 192416:193790, ack 4489, win 1691, options [nop,nop,TS val 691267 ecr 1695414], length 1374
18:52:21.386252 IP workstation.local.2222 > 172.24.237.51.58720: Flags [P.], seq 193790:194816, ack 4489, win 1691, options [nop,nop,TS val 691267 ecr 1695415], length 1026
18:52:21.388703 IP workstation.local.2222 > 172.24.237.51.58720: Flags [.], seq 194816:196190, ack 4489, win 1691, options [nop,nop,TS val 691268 ecr 1695415], length 1374
18:52:21.390558 IP workstation.local.2222 > 172.24.237.51.58720: Flags [P.], seq 196190:197216, ack 4489, win 1691, options [nop,nop,TS val 691268 ecr 1695417], length 1026
18:52:21.392967 IP workstation.local.2222 > 172.24.237.51.58720: Flags [.], seq 197216:198590, ack 4489, win 1691, options [nop,nop,TS val 691269 ecr 1695417], length 1374
18:52:21.395103 IP workstation.local.2222 > 172.24.237.51.58720: Flags [.], seq 198590:199964, ack 4489, win 1691, options [nop,nop,TS val 691269 ecr 1695417], length 1374
18:52:21.396575 IP workstation.local.2222 > 172.24.237.51.58720: Flags [P.], seq 199964:200816, ack 4489, win 1691, options [nop,nop,TS val 691270 ecr 1695418], length 852
18:52:21.398286 IP workstation.local.2222 > 172.24.237.51.58720: Flags [P.], seq 200816:202016, ack 4489, win 1691, options [nop,nop,TS val 691270 ecr 1695419], length 1200
18:52:21.401475 IP workstation.local.2222 > 172.24.237.51.58720: Flags [.], seq 202016:203390, ack 4489, win 1691, options [nop,nop,TS val 691271 ecr 1695419], length 1374
18:52:21.403329 IP workstation.local.2222 > 172.24.237.51.58720: Flags [P.], seq 203390:204416, ack 4489, win 1691, options [nop,nop,TS val 691271 ecr 1695420], length 1026
18:52:21.405735 IP workstation.local.2222 > 172.24.237.51.58720: Flags [.], seq 204416:205790, ack 4489, win 1691, options [nop,nop,TS val 691272 ecr 1695420], length 1374
18:52:21.407870 IP workstation.local.2222 > 172.24.237.51.58720: Flags [.], seq 205790:207164, ack 4489, win 1691, options [nop,nop,TS val 691272 ecr 1695420], length 1374
18:52:21.408886 IP workstation.local.2222 > 172.24.237.51.58720: Flags [P.], seq 207164:208016, ack 4489, win 1691, options [nop,nop,TS val 691273 ecr 1695421], length 852
18:52:21.411919 IP workstation.local.2222 > 172.24.237.51.58720: Flags [P.], seq 208016:209216, ack 4489, win 1691, options [nop,nop,TS val 691273 ecr 1695422], length 1200
18:52:21.414291 IP workstation.local.2222 > 172.24.237.51.58720: Flags [.], seq 209216:210590, ack 4489, win 1691, options [nop,nop,TS val 691274 ecr 1695422], length 1374
18:52:21.416453 IP workstation.local.2222 > 172.24.237.51.58720: Flags [.], seq 210590:211964, ack 4489, win 1691, options [nop,nop,TS val 691275 ecr 1695422], length 1374
18:52:21.416553 IP workstation.local.2222 > 172.24.237.51.58720: Flags [P.], seq 211964:212816, ack 4489, win 1691, options [nop,nop,TS val 691275 ecr 1695423], length 852
18:52:21.420662 IP workstation.local.2222 > 172.24.237.51.58720: Flags [.], seq 212816:214190, ack 4489, win 1691, options [nop,nop,TS val 691276 ecr 1695423], length 1374
18:52:21.422800 IP workstation.local.2222 > 172.24.237.51.58720: Flags [.], seq 214190:215564, ack 4489, win 1691, options [nop,nop,TS val 691276 ecr 1695423], length 1374
18:52:21.424943 IP workstation.local.2222 > 172.24.237.51.58720: Flags [.], seq 215564:216938, ack 4489, win 1691, options [nop,nop,TS val 691277 ecr 1695423], length 1374
18:52:21.427117 IP workstation.local.2222 > 172.24.237.51.58720: Flags [.], seq 216938:218312, ack 4489, win 1691, options [nop,nop,TS val 691277 ecr 1695423], length 1374
18:52:21.429296 IP workstation.local.2222 > 172.24.237.51.58720: Flags [.], seq 218312:219686, ack 4489, win 1691, options [nop,nop,TS val 691278 ecr 1695423], length 1374
18:52:21.431418 IP workstation.local.2222 > 172.24.237.51.58720: Flags [.], seq 219686:221060, ack 4489, win 1691, options [nop,nop,TS val 691278 ecr 1695423], length 1374
18:52:21.435700 IP workstation.local.2222 > 172.24.237.51.58720: Flags [.], seq 221060:222434, ack 4489, win 1691, options [nop,nop,TS val 691279 ecr 1695423], length 1374
18:52:21.437847 IP workstation.local.2222 > 172.24.237.51.58720: Flags [.], seq 222434:223808, ack 4489, win 1691, options [nop,nop,TS val 691280 ecr 1695423], length 1374
18:52:21.439983 IP workstation.local.2222 > 172.24.237.51.58720: Flags [.], seq 223808:225182, ack 4489, win 1691, options [nop,nop,TS val 691280 ecr 1695423], length 1374
18:52:21.530008 IP workstation.local.2222 > 172.24.237.51.58720: Flags [.], seq 225182:226556, ack 4489, win 1691, options [nop,nop,TS val 691303 ecr 1695434], length 1374
18:52:21.530026 IP workstation.local.2222 > 172.24.237.51.58720: Flags [.], seq 226556:227930, ack 4489, win 1691, options [nop,nop,TS val 691303 ecr 1695434], length 1374
18:52:21.531091 IP workstation.local.2222 > 172.24.237.51.58720: Flags [P.], seq 211964:212816, ack 4489, win 1691, options [nop,nop,TS val 691303 ecr 1695451], length 852
18:52:21.533271 IP workstation.local.2222 > 172.24.237.51.58720: Flags [.], seq 212816:214190, ack 4489, win 1691, options [nop,nop,TS val 691304 ecr 1695452], length 1374
18:52:21.534258 IP workstation.local.2222 > 172.24.237.51.58720: Flags [.], seq 214190:215564, ack 4489, win 1691, options [nop,nop,TS val 691304 ecr 1695452], length 1374
18:52:21.534401 IP workstation.local.2222 > 172.24.237.51.58720: Flags [.], seq 215564:216938, ack 4489, win 1691, options [nop,nop,TS val 691304 ecr 1695452], length 1374
18:52:21.534989 IP workstation.local.2222 > 172.24.237.51.58720: Flags [.], seq 227930:229304, ack 4489, win 1691, options [nop,nop,TS val 691304 ecr 1695452], length 1374
18:52:21.537445 IP workstation.local.2222 > 172.24.237.51.58720: Flags [P.], seq 229304:229616, ack 4489, win 1691, options [nop,nop,TS val 691305 ecr 1695453], length 312
18:52:21.539842 IP workstation.local.2222 > 172.24.237.51.58720: Flags [.], seq 229616:230990, ack 4489, win 1691, options [nop,nop,TS val 691305 ecr 1695453], length 1374
18:52:21.541991 IP workstation.local.2222 > 172.24.237.51.58720: Flags [.], seq 230990:232364, ack 4489, win 1691, options [nop,nop,TS val 691306 ecr 1695454], length 1374
18:52:21.542093 IP workstation.local.2222 > 172.24.237.51.58720: Flags [P.], seq 232364:233216, ack 4489, win 1691, options [nop,nop,TS val 691306 ecr 1695454], length 852
18:52:21.545194 IP workstation.local.2222 > 172.24.237.51.58720: Flags [P.], seq 233216:234416, ack 4489, win 1691, options [nop,nop,TS val 691307 ecr 1695455], length 1200
18:52:21.547015 IP workstation.local.2222 > 172.24.237.51.58720: Flags [P.], seq 234416:235616, ack 4489, win 1691, options [nop,nop,TS val 691307 ecr 1695456], length 1200
18:52:21.550506 IP workstation.local.2222 > 172.24.237.51.58720: Flags [.], seq 235616:236990, ack 4489, win 1691, options [nop,nop,TS val 691308 ecr 1695456], length 1374
18:52:21.551768 IP workstation.local.2222 > 172.24.237.51.58720: Flags [P.], seq 236990:238016, ack 4489, win 1691, options [nop,nop,TS val 691308 ecr 1695456], length 1026
18:52:21.554561 IP workstation.local.2222 > 172.24.237.51.58720: Flags [P.], seq 238016:239216, ack 4489, win 1691, options [nop,nop,TS val 691309 ecr 1695457], length 1200
18:52:21.556835 IP workstation.local.2222 > 172.24.237.51.58720: Flags [P.], seq 239216:240416, ack 4489, win 1691, options [nop,nop,TS val 691310 ecr 1695458], length 1200
18:52:21.558636 IP workstation.local.2222 > 172.24.237.51.58720: Flags [P.], seq 240416:241616, ack 4489, win 1691, options [nop,nop,TS val 691310 ecr 1695459], length 1200
18:52:21.561270 IP workstation.local.2222 > 172.24.237.51.58720: Flags [.], seq 241616:242990, ack 4489, win 1691, options [nop,nop,TS val 691311 ecr 1695459], length 1374
18:52:21.563389 IP workstation.local.2222 > 172.24.237.51.58720: Flags [.], seq 242990:244364, ack 4489, win 1691, options [nop,nop,TS val 691311 ecr 1695459], length 1374
18:52:21.564487 IP workstation.local.2222 > 172.24.237.51.58720: Flags [P.], seq 244364:245216, ack 4489, win 1691, options [nop,nop,TS val 691312 ecr 1695460], length 852
18:52:21.566163 IP workstation.local.2222 > 172.24.237.51.58720: Flags [P.], seq 245216:246416, ack 4489, win 1691, options [nop,nop,TS val 691312 ecr 1695460], length 1200
18:52:21.568559 IP workstation.local.2222 > 172.24.237.51.58720: Flags [P.], seq 246416:247616, ack 4489, win 1691, options [nop,nop,TS val 691313 ecr 1695461], length 1200
18:52:21.571925 IP workstation.local.2222 > 172.24.237.51.58720: Flags [.], seq 247616:248990, ack 4489, win 1691, options [nop,nop,TS val 691313 ecr 1695461], length 1374
18:52:21.573795 IP workstation.local.2222 > 172.24.237.51.58720: Flags [P.], seq 248990:250016, ack 4489, win 1691, options [nop,nop,TS val 691314 ecr 1695462], length 1026
18:52:21.575562 IP workstation.local.2222 > 172.24.237.51.58720: Flags [P.], seq 250016:251216, ack 4489, win 1691, options [nop,nop,TS val 691314 ecr 1695463], length 1200
18:52:21.577399 IP workstation.local.2222 > 172.24.237.51.58720: Flags [P.], seq 251216:252416, ack 4489, win 1691, options [nop,nop,TS val 691315 ecr 1695463], length 1200
18:52:21.580430 IP workstation.local.2222 > 172.24.237.51.58720: Flags [.], seq 252416:253790, ack 4489, win 1691, options [nop,nop,TS val 691316 ecr 1695463], length 1374
18:52:21.582299 IP workstation.local.2222 > 172.24.237.51.58720: Flags [P.], seq 253790:254816, ack 4489, win 1691, options [nop,nop,TS val 691316 ecr 1695465], length 1026
18:52:21.584115 IP workstation.local.2222 > 172.24.237.51.58720: Flags [P.], seq 254816:256016, ack 4489, win 1691, options [nop,nop,TS val 691316 ecr 1695465], length 1200
18:52:21.586214 IP workstation.local.2222 > 172.24.237.51.58720: Flags [P.], seq 256016:257216, ack 4489, win 1691, options [nop,nop,TS val 691317 ecr 1695465], length 1200
18:52:21.588989 IP workstation.local.2222 > 172.24.237.51.58720: Flags [.], seq 257216:258590, ack 4489, win 1691, options [nop,nop,TS val 691318 ecr 1695465], length 1374
18:52:21.590830 IP workstation.local.2222 > 172.24.237.51.58720: Flags [P.], seq 258590:259616, ack 4489, win 1691, options [nop,nop,TS val 691318 ecr 1695467], length 1026
18:52:21.592624 IP workstation.local.2222 > 172.24.237.51.58720: Flags [P.], seq 259616:260816, ack 4489, win 1691, options [nop,nop,TS val 691319 ecr 1695467], length 1200
18:52:21.594423 IP workstation.local.2222 > 172.24.237.51.58720: Flags [P.], seq 260816:262016, ack 4489, win 1691, options [nop,nop,TS val 691319 ecr 1695468], length 1200
18:52:21.597499 IP workstation.local.2222 > 172.24.237.51.58720: Flags [.], seq 262016:263390, ack 4489, win 1691, options [nop,nop,TS val 691320 ecr 1695468], length 1374
18:52:21.599676 IP workstation.local.2222 > 172.24.237.51.58720: Flags [.], seq 263390:264764, ack 4489, win 1691, options [nop,nop,TS val 691320 ecr 1695468], length 1374
18:52:21.600703 IP workstation.local.2222 > 172.24.237.51.58720: Flags [P.], seq 264764:265616, ack 4489, win 1691, options [nop,nop,TS val 691321 ecr 1695469], length 852
18:52:21.602845 IP workstation.local.2222 > 172.24.237.51.58720: Flags [P.], seq 265616:266816, ack 4489, win 1691, options [nop,nop,TS val 691321 ecr 1695470], length 1200
18:52:21.604707 IP workstation.local.2222 > 172.24.237.51.58720: Flags [P.], seq 266816:268016, ack 4489, win 1691, options [nop,nop,TS val 691322 ecr 1695470], length 1200
18:52:21.608244 IP workstation.local.2222 > 172.24.237.51.58720: Flags [.], seq 268016:269390, ack 4489, win 1691, options [nop,nop,TS val 691322 ecr 1695470], length 1374
18:52:21.610096 IP workstation.local.2222 > 172.24.237.51.58720: Flags [P.], seq 269390:270416, ack 4489, win 1691, options [nop,nop,TS val 691323 ecr 1695471], length 1026
18:52:21.611912 IP workstation.local.2222 > 172.24.237.51.58720: Flags [P.], seq 270416:271616, ack 4489, win 1691, options [nop,nop,TS val 691323 ecr 1695472], length 1200
